Question #,Scrambled sentence,Answer
1,day / smartphones / use / people / every / many,Many people use smartphones every day.
2,quickly / communicate / people / smartphones / help,Smartphones help people communicate quickly.
3,internet / connect / smartphones / many / the / to,Many smartphones connect to the internet.
4,seconds / messages / can / people / in / send,People can send messages in seconds.
5,calls / allow / smartphones / video / also,Smartphones also allow video calls.
6,for / smartphones / students / many / use / learning,Many students use smartphones for learning.
7,quickly / information / can / very / find / people,People can find information very quickly.
8,technology / powerful / contain / smartphones / computer,Smartphones contain powerful computer technology.
9,every / apps / many / help / day / people,Many apps help people every day.
10,modern / life / smartphones / changing / continue,Smartphones continue changing modern life.
11,own / smartphones / people / billions / today / of,Today billions of people own smartphones.
12,useful / devices / most / are / among / smartphones / the,Smartphones are among the most useful devices.
13,fly / can / know / birds / that / people / many,Many people know that birds can fly.
14,all / penguins / at / cannot / fly / however,However penguins cannot fly at all.
15,different / their / use / way / wings / a / penguins / in,Penguins use their wings in a different way.
16,swimmers / excellent / are / penguins,Penguins are excellent swimmers.
17,move / through / use / they / wings / water / their / to,They use their wings to move through water.
18,very / swim / quickly / help / their / bodies / them,Their bodies help them swim very quickly.
19,water / catch / fish / penguins / can / under / the,Penguins can catch fish under the water.
20,hemisphere / southern / the / penguins / in / most / live,Most penguins live in the Southern Hemisphere.
21,places / live / very / cold / penguins / some / in,Some penguins live in very cold places.
22,cold / are / live / places / others / that / very / not / in,Others live in places that are not very cold.
23,ocean / their / near / spend / penguins / time / much / of / the,Penguins spend much of their time near the ocean.
24,world / popular / the / animals / today / most / among / penguins / the / in / are,Today penguins are among the most popular animals in the world.
25,deserts / live / camels / know / people / that / many / in,Many people know that camels live in deserts.
26,dry / very / hot / places / are / deserts / and,Deserts are very hot and dry places.
27,there / live / need / animals / special / features / to,Animals need special features to live there.
28,without / many / can / camels / water / go / days,Camels can go many days without water.
29,water / saving / at / bodies / good / are / their,Their bodies are good at saving water.
30,hot / survive / helps / weather / in / them / this,This helps them survive in hot weather.
31,long / have / also / camels / legs,Camels also have long legs.
32,hot / farther / from / keep / ground / their / the / bodies / long / legs / their,Their long legs keep their bodies farther from the hot ground.
33,eyes / protect / thick / have / camels / their / eyelashes / to,Camels have thick eyelashes to protect their eyes.
34,keep / help / out / eyelashes / sand / these,These eyelashes help keep out sand.
35,their / can / camels / during / also / nostrils / sandstorms / close,Camels can also close their nostrils during sandstorms.
36,many / transportation / people / years / have / camels / for / used / for,People have used camels for transportation for many years.
